,Title,Title_Entity,Title_Salience,Description,Description_Entity,Description_Salience
31,babi mop onesi,['onesi'],[1.0],onesi doubl mop babi mop onesi perfect new parent great gift mother day father day plus it funni dress cute babi babi mop onesi set floor need clean may first need get thing start call infant across room pretti soon they'll there child exploit involv kid best anyway crawl babi mop he also learn respons healthi work ethic — 99 unuseless japanes invent author kenji kawakami publish ww norton co new york 1998 habit form earli life everybodi need work contribut healthi societi numer studi prove experi children face first year shape rest life relationship parent decid kind adult becom save friend lot useless discuss share household chore accustom babi earli stage perfect gift perfect gift best friend verg progress spend time friend absorb famili life realli think still care much offspr consum spare time won't believ much around babi familyfriend restaur hotel car train tv show book web site even app famili friend clean tool hard believ might actual increas chanc meet friend within next year,"['mop', 'gift', 'parent', 'kenji kawakami', 'children', 'kid', 'room pretti', 'floor', 'call infant', 'friend', 'thing', 'mop', 'child', 'life relationship parent', 'habit form', 'life everybodi', 'ww norton', 'respons', 'work ethic', 'work', 'japanes', 'life realli', 'offspr', 'consum', 'meet friend', 'friend', 'new york', 'increas', 'tool', 'hotel car train tv show book web site', 'believ', 'friend', 'friend', 'gift', 'gift', 'household chore', 'verg progress', '1998', '99', '1998']","[0.20325669646263123, 0.09286338090896606, 0.08505569398403168, 0.04430070146918297, 0.03776596486568451, 0.03252744674682617, 0.02909877523779869, 0.02909877523779869, 0.02909877523779869, 0.02594929002225399, 0.02484932355582714, 0.02241971343755722, 0.02241971343755722, 0.020091911777853966, 0.019959598779678345, 0.019959598779678345, 0.019959598779678345, 0.019717779010534286, 0.019717779010534286, 0.019370416179299355, 0.0172418262809515, 0.014531577005982399, 0.013838015496730804, 0.013838015496730804, 0.013764418661594391, 0.013764418661594391, 0.011841200292110443, 0.00994325801730156, 0.009702522307634354, 0.009702522307634354, 0.009702522307634354, 0.00864267535507679, 0.00864267535507679, 0.007594376336783171, 0.007594376336783171, 0.006087332032620907, 0.006087332032620907, 0.0, 0.0, 0.0]"
32,william shakespear star war trilog,"['william shakespear', 'star war trilog']","[0.5484389066696167, 0.4515610635280609]",introduc william shakespear star war trilog experi star war saga reimagin shakespear drama come complet authent meter vers plus theatric monologu dialogu first royal imperi box set includ three volum origin trilog verili new hope empir striketh back jedi doth return plus get free 8by34inch fullcolor poster gift entertain impress fan star war shakespear alik everi scene charact film appear play final book featur woodcutstyl illustr enjoy elizabethan version star war galaxi prais william shakespear star war “a quirki addit genrebust canon”—entertain week “a great gift everi geek know matter passion”—huffington post “the book brilliant you'll wonder someon didn't think sooner”—past magazin “at last mother mashup upon us”—cnetcom “william shakespear star war exact need next geeki houseparty”—torcom “nicola delort woodcutstyl illustr fabul mixtur old new”—bo bo “the ultim fan fic”—abc news radio,"['star war', 'star war saga reimagin shakespear drama', 'galaxi prais william shakespear', 'complet authent meter vers', 'version star war', 'star war', 'impress fan star war', 'empir striketh', 'origin', 'doth return', 'imperi box set', 'hope', 'poster gift', 'woodcutstyl illustr', 'gift', 'star war', 'film', 'matter passion', 'canon', 'need', 'quirki addit genrebust', 'shakespear alik everi scene charact', 'everi geek', 'huffington post', 'news radio', 'fan fic', 'geeki houseparty', 'cnetcom', 'torcom', 'book', 'mother mashup', 'nicola delort woodcutstyl illustr fabul mixtur', '8', 'three']","[0.13268135488033295, 0.11740004271268845, 0.07863708585500717, 0.06193218380212784, 0.03593532741069794, 0.03593532741069794, 0.03550294041633606, 0.035257983952760696, 0.035257983952760696, 0.035257983952760696, 0.035257983952760696, 0.035257983952760696, 0.03340448439121246, 0.026601219549775124, 0.025263627991080284, 0.024967104196548462, 0.02390483021736145, 0.022220062091946602, 0.021685000509023666, 0.01678243651986122, 0.014362468384206295, 0.014187841676175594, 0.013723265379667282, 0.012443154118955135, 0.011769930832087994, 0.011769930832087994, 0.009946521371603012, 0.009946521371603012, 0.009946521371603012, 0.008406060747802258, 0.00738602364435792, 0.006968803703784943, 0.0, 0.0]"
33,kid wine glass,['glass'],[1.0],introduc kid wine glass barcon kid perfect glass enjoy favorit wine long day take care famili cool wine glass make perfect gift parent made real glass hold 17 oz fill rim great stemless wine glass use serv wine beer even mix cocktail imag screenprint outsid use ink special made glasswar commerci dishwash safe scrub imprint abras materi great gift mother day father day birthday winelov anyon around kid time,"['glass', 'glass', 'glass', 'wine glass', 'glass', 'gift parent', 'beer', 'gift', 'imprint abras', 'cocktail imag screenprint outsid use ink', '17']","[0.32044777274131775, 0.2556311786174774, 0.07809196412563324, 0.07719646394252777, 0.0604739747941494, 0.055338189005851746, 0.05156247317790985, 0.04449479281902313, 0.039250679314136505, 0.017512500286102295, 0.0]"
34,adult achiev sticker,['achiev sticker'],[1.0],introduc adult achiev sticker adult hard deserv recognit job well done adult achiev sticker help commemor adult mileston product includ 16 hilari sticker reward friend special sticker perfect white eleph gift christma present housewarm gift birthday present hostess gift bachelorett parti bring smile someon face,"['achiev sticker adult', 'job', 'sticker', 'mileston product', 'adult achiev sticker help', 'sticker reward friend', 'gift', 'hostess', 'bachelorett parti', 'face', 'smile', 'gift', '16']","[0.33582571148872375, 0.09951979666948318, 0.0914948433637619, 0.0750284269452095, 0.07414480298757553, 0.06904947757720947, 0.06507949531078339, 0.05247199535369873, 0.03931296989321709, 0.03700928017497063, 0.03200724348425865, 0.02905595675110817, 0.0]"
35,runni nose funni soap dispens,"['nose', 'soap dispens']","[0.6507119536399841, 0.34928804636001587]",gross weird runni nose funni soap dispens brand new high qualiti wacki gross funni dispens press nose gel ooz right nostril easili refil unscrew replac cap back attach easili flat surfac suction cup nail perfect uniqu gift someon need humor hygien refil done easili unscrew cap back nose gross great gag gift idea boy wacki prankster dimens 14cm x 85cm x 18 cm runni nose funni soap dispens great gag gift anyon,"['soap', 'nose gel', 'uniqu gift', 'cap', 'unscrew cap', 'suction cup', 'nostril', 'funni dispens', 'humor hygien', 'wacki prankster dimens', 'gag gift', 'soap', 'anyon', 'gag gift', 'boy', '14', '18', '85']","[0.25299274921417236, 0.09148210287094116, 0.07848214358091354, 0.07096660882234573, 0.06607314944267273, 0.06333912909030914, 0.06258729845285416, 0.06244191899895668, 0.058254681527614594, 0.04419103264808655, 0.03870673105120659, 0.03535838425159454, 0.03111758641898632, 0.02440984733402729, 0.019596638157963753, 0.0, 0.0, 0.0]"
36,prime 55 gallon drum lube,"['drum lube', '55']","[1.0, 0.0]",never run lube prime 55 gallon drum lube go prime lube wrestl match biggest adult parti ever look simpli jawdrop amount lube passion natur waterbas lubric readi get fun start 55 gallon drum superb formula natur feel keep moist longer also work great toy materi easili wash away warm water mild soap may never run lube size 55 gallon note includ pump ship via freight due weight limit fun prime 55 gallon drum lube,"['lube prime', 'gallon drum lube', 'natur waterbas lubric readi', 'lube', 'match', 'adult parti', 'formula natur', 'jawdrop', 'toy materi easili', 'drum lube', 'freight', 'lube size', 'pump ship', 'weight', 'gallon note', 'water', 'soap', '55', '55', '55', '55']","[0.1637870967388153, 0.1424058973789215, 0.1395474672317505, 0.09632672369480133, 0.06567049026489258, 0.06413021683692932, 0.04535951837897301, 0.044818244874477386, 0.041700370609760284, 0.03299026936292648, 0.03159554302692413, 0.03159554302692413, 0.03159554302692413, 0.022223737090826035, 0.018289318308234215, 0.01398201659321785, 0.01398201659321785, 0.0, 0.0, 0.0, 0.0]"
37,banana phone handset,['banana phone handset'],[1.0],banana phone handset bluetoothen mobil handset banana phone handset connect smartphon interact voic assist talk friend banana we'r take bite appl accessori market one banana time hilari gift work android appl phone,"['banana phone handset', 'handset banana phone handset', 'talk friend banana', 'voic', 'smartphon', 'hilari gift work android appl phone', 'bite appl accessori market', 'one']","[0.3910326063632965, 0.17486685514450073, 0.13213229179382324, 0.09952887892723083, 0.09952887892723083, 0.07100195437669754, 0.031908534467220306, 0.0]"
38,ben jerri ice cream lock,['ice cream lock'],[1.0],lock away precious item ben jerri ice cream lock perfect gift friend live roommat great colleg student buy ice cream eas know lock lock come easi twopiec assembl twistlock instal keep ice cream safe threedigit super secret preassign combin product also come warranti doesn't work get anoth,"['item', 'ice cream', 'gift friend', 'lock lock', 'ice cream', 'colleg student', 'warranti', 'preassign combin product', 'anoth', 'ice cream']","[0.2697999179363251, 0.13883326947689056, 0.11832953989505768, 0.11503726243972778, 0.09726492315530777, 0.07787001132965088, 0.0552322156727314, 0.05020064860582352, 0.049603838473558426, 0.027828384190797806]"
39,cook coolio recip,['recip'],[1.0],introduc cook coolio recip there one thing coolio longer rap cook recip includ comfort food healthi twist don't break bank can't find fusion like blasian black asian ghettalian ghetto italian restaur home plus recip quick easi coolio start make thirtyminut meal ten year old sinc develop whole new cuisin ghetto gourmet start ghetto gourmet adventur “soul rolls” followup “fingerlickin ribstickin fallofftheboneandintoyourmouth chicken” finish “banana babababread” sweeten golden honey cook coolio recip “how becom kitchen pimp” “chillin grillin'” “pasta like rasta” guid creat fivestar meal starstar price coolio say “all need littl bit food littl bit knowhow”,"['recip', 'rap cook recip', 'thing', 'fusion', 'ghetto gourmet', 'comfort food healthi twist', 'bank', 'ghetto gourmet', 'restaur home', 'soul rolls', 'followup', 'finish', 'thirtyminut meal', 'pasta', 'rasta', 'grillin', 'fingerlickin ribstickin fallofftheboneandintoyourmouth chicken', 'coolio recip', 'banana babababread', 'kitchen pimp', 'honey', 'price coolio', 'ten', 'one']","[0.1572173684835434, 0.13729986548423767, 0.12819913029670715, 0.0778145119547844, 0.05107676610350609, 0.05074664205312729, 0.05074664205312729, 0.03969752788543701, 0.03453962504863739, 0.03212383762001991, 0.03212383762001991, 0.03212383762001991, 0.03118278831243515, 0.024307796731591225, 0.024307796731591225, 0.024307796731591225, 0.019118640571832657, 0.01337996032088995, 0.011271112598478794, 0.01073252409696579, 0.01073252409696579, 0.00694947550073266, 0.0, 0.0]"
40,4 set lightsab glow chopstick,"['glow chopstick', '4']","[1.0, 0.0]",star war light saber chop stick look wonder glow chopstick look like littl lightsab star war plus eat dark problem watch netflix chill glow chopstick favorit takeout 4 set enjoy friend kid especi love great lightsab parti everyon love star war theme parti lightsab enhanc fantasi make special meal fun excit plus work mini lightsab think dozen creativ parti use buy led lightsab chopstick star war theme occas fun idea thought star war goodi bag star war appet utensil star war parti activ star war tabl centerpiec star war ice cake cupcak topper creativ idea mini lightsab let us know comment alreadi bought share pictur fun led lightsab chopstick fun food war meal glow chopstick impress date kid portabl light carri fit pocket new batteri stopper includ easili replac 3 x lr41 camera batteri unscrew screw conveni led illumin bright color easi use push button life parti make friend jealous get attent show true fan bargain 2 price 1 happi 100 custom satisfact guarante,"['star war', 'glow chopstick', 'star war light saber chop stick look', 'problem', 'creativ parti', 'friend kid especi', 'glow chopstick', 'star war theme', 'lightsab parti', 'takeout', 'set', 'screw conveni', 'lightsab', 'idea', 'lightsab', 'chopstick star war theme', 'meal', 'cupcak topper creativ idea', 'buy', 'star war goodi bag star war appet utensil star war parti activ star war tabl centerpiec star war ice cake', 'comment alreadi', 'camera batteri', 'excit', 'batteri stopper', 'pictur fun', 'parti lightsab enhanc fantasi', 'color easi', 'show', 'fan bargain', 'push button life', 'guarante', 'happi', 'price', 'food war meal glow chopstick', 'easili replac 3', '3', '100', '1', '4', '2']","[0.12208740413188934, 0.10428816825151443, 0.07303816080093384, 0.07303816080093384, 0.050694819539785385, 0.04381692036986351, 0.04205216094851494, 0.032257020473480225, 0.032257020473480225, 0.02839761972427368, 0.02839761972427368, 0.028055982664227486, 0.025164218619465828, 0.022703316062688828, 0.02228790894150734, 0.022158384323120117, 0.021890776231884956, 0.020350798964500427, 0.019256604835391045, 0.017899859696626663, 0.017899859696626663, 0.015377550385892391, 0.015276173129677773, 0.01352049969136715, 0.01241208054125309, 0.01143062487244606, 0.010205762460827827, 0.00948292575776577, 0.00948292575776577, 0.00948292575776577, 0.00948292575776577, 0.00948292575776577, 0.00948292575776577, 0.00887294765561819, 0.008014027960598469, 0.0, 0.0, 0.0, 0.0, 0.0]"
41,magic canada cute cheap coffe mug,['coffe mug'],[1.0],cute cheap coffe mug celebr magic canada one 15 oz 11 oz version found 15ounc mug featur larg handl easi grip wraparound print plus dishwash microwav safe print usa made canadian attent lookhuman product origin design creat human design team seller similar design lower price affili lookhuman author resel origin design amaz product great custom servic pleas make sure choos “lookhuman” seller item print usa,"['mug', 'version', 'print', 'product origin design', 'print', 'lookhuman', 'human design team seller', 'dishwash', 'resel origin design amaz product', 'custom servic pleas', 'seller item print', 'lookhuman', 'choos', 'design', 'price', 'author', 'one', '11', '15', '15']","[0.24838437139987946, 0.11757148057222366, 0.0718003585934639, 0.07078544050455093, 0.06606389582157135, 0.0656873881816864, 0.0604240745306015, 0.05722993612289429, 0.045856937766075134, 0.04038482904434204, 0.03536675497889519, 0.032303910702466965, 0.02842564508318901, 0.023925308138132095, 0.017894836142659187, 0.017894836142659187, 0.0, 0.0, 0.0, 0.0]"
42,peni water gun,['water gun'],[1.0],perfect pride bachelor bachelorett laugh product materi brand new pvc plastic good qualiti water leakag product size l x w 17 x 10cm 669 x 394” weight 875g packag includ 2 pcs creativ funni shape lifelik model make differ other perfect hen stag parti girl night bachelor parti halloween fanci dress parti,"['pride bachelor bachelorett laugh product', 'pvc plastic', 'weight', 'qualiti water leakag product size', 'packag', 'pcs', 'girl', 'hen stag', 'bachelor', 'dress parti', 'model', '2', '17', '10', '394', '875', '669']","[0.32322004437446594, 0.120267853140831, 0.08369260281324387, 0.08271040767431259, 0.07704505324363708, 0.07704505324363708, 0.05859404057264328, 0.05859404057264328, 0.05137331411242485, 0.04135759547352791, 0.02610001340508461, 0.0, 0.0, 0.0, 0.0, 0.0, 0.0]"
43,meow book cat,['meow book cat'],[1.0],book contain repetit text meow book novel cat written perspect cat one word describ wondrous adventur wait insid cover meow also word find insid cover meow meow friend obsess cat book spoil cat planet definit need meow book also crazi dog friend check woof book,"['book', 'perspect cat', 'text meow book novel cat', 'cover meow', 'word', 'meow meow friend', 'word', 'meow book', 'cat book spoil cat planet definit', 'dog friend check woof book', 'one']","[0.3513818681240082, 0.10847382247447968, 0.10847382247447968, 0.09441307932138443, 0.09121400862932205, 0.06010714918375015, 0.05667893588542938, 0.048629458993673325, 0.040418729186058044, 0.04020912945270538, 0.0]"
44,joke hand sanit,['joke hand sanit'],[1.0],mayb touch genit joke hand sanit antibacteri hand gel witti packag pure use hand contain alcohol may sting anywher els kill 999 germ contact antibacteri gel also includ alo vera soften skin perfect gift present dad aunt uncl brother boyfriend husband teenag,"['hand', 'gel', 'witti', 'germ contact antibacteri gel', 'anywher els', 'alcohol', 'dad aunt', 'gift', 'uncl brother boyfriend husband teenag', 'skin', '999']","[0.17298057675361633, 0.16069680452346802, 0.14241644740104675, 0.10350441932678223, 0.10284833610057831, 0.0981280505657196, 0.06960098445415497, 0.06960098445415497, 0.04916948452591896, 0.03105391561985016, 0.0]"
45,american flag casual summer suit,"['american', 'flag', 'summer suit']","[0.4830176830291748, 0.339973509311676, 0.17700879275798798]",american dream proud american show world stylish usa flag casual summer suit best way support countri nation holiday sport game qualiti casual suit star stripe suit made high qualiti open woven fabric machinewash full line genuin pocket button belt loop full set cloth come complet set match pant jacket tie make instant look dapper learn suitmeist size modern fit size chart mani occas casual summer suit ideal steal show mani occas like independ day sport game bachelor parti wear money back guarante 100 satisfi don't worri offer 30 day money back guarante shop carefre get today add cart plus want even casual check american flag onesi jumpsuit men,"['flag', 'american', 'suit star stripe suit', 'countri nation holiday sport game', 'cloth', 'chart mani', 'carefre', 'match pant jacket tie', 'line', 'genuin pocket button belt loop', 'money', 'money', 'flag', 'cart', 'onesi jumpsuit men', 'steal show mani', 'sport game bachelor', '100', '30']","[0.19281397759914398, 0.16804133355617523, 0.09625792503356934, 0.07789928466081619, 0.053543005138635635, 0.04955805465579033, 0.048069827258586884, 0.04749638959765434, 0.04692962020635605, 0.04692962020635605, 0.0375787653028965, 0.030595863237977028, 0.026451578363776207, 0.02327069081366062, 0.02327069081366062, 0.016652673482894897, 0.014640704728662968, 0.0, 0.0]"
46,whoopass sale,['sale'],[1.0],main ingredi “pwnage” come leav plant know “beat flower” flower beauti produc smell similar sweat flower found countri call kickassistan think one enough buy two can whoopass hard satisfi get 4 whoopass highlevel shit need get 24 can whoopass whoopass open someon today give hothead friend today true content compost,"['pwnage', 'ingredi', 'sweat flower', 'flower', 'call kickassistan', 'two', 'flower beauti produc', 'content compost', 'hothead friend', 'plant', 'whoopass', 'someon', 'shit need', 'whoopass', 'two', 'one', '4', '24']","[0.2395203411579132, 0.18930748105049133, 0.09193965792655945, 0.06466894596815109, 0.056075867265462875, 0.05410940572619438, 0.05283559486269951, 0.04311881214380264, 0.04311881214380264, 0.04260481148958206, 0.042371444404125214, 0.03733035549521446, 0.024158699437975883, 0.018839769065380096, 0.0, 0.0, 0.0, 0.0]"
47,american flag beer pong float,"['american', 'flag', 'beer pong float']","[0.4830176830291748, 0.339973509311676, 0.17700879275798798]",usa flag beer pong float plus use bed float loung tan pass whatev even inflat hair dryer air pump compressor beer pong float serious best qualiti parti fun elev pool parti full 10 cup beer pong float built cooler repeat built cooler fuck yes huge size 6 feet long x 3 feet wide provid comfort float parti proof – super thick extra durabl raft grade pvc that scratch tear resist rapid valv fast valv allow inflat hairdryer toy air pump compressor deflat 5 time faster tradit valv like american flag beer pong float also enjoy trump pool float trump support hater alik it hilari complet 4th juli look check american flag summer suit,"['beer pong float', 'flag', 'bed float loung tan pass', 'raft grade pvc', 'hair dryer air pump compressor beer pong', 'repeat', 'provid comfort float', 'beer pong float', 'qualiti', 'pool', 'beer pong float', 'proof', 'tear', 'flag', 'valv', 'flag', 'trump pool float trump support hater', 'summer suit', 'american', 'valv', 'inflat hairdryer toy air pump compressor', '6', '5', '3', '4', '10']","[0.3335183560848236, 0.1135551705956459, 0.09252804517745972, 0.05755970999598503, 0.048565372824668884, 0.04119797796010971, 0.03724965453147888, 0.03680630028247833, 0.029803963378071785, 0.028245430439710617, 0.025967033579945564, 0.02312939241528511, 0.02312939241528511, 0.021776294335722923, 0.01988835260272026, 0.015310653485357761, 0.011994500644505024, 0.010486594401299953, 0.010447988286614418, 0.010052618570625782, 0.008787203580141068, 0.0, 0.0, 0.0, 0.0, 0.0]"
48,abraham lincoln four score shirt,"['abraham lincoln', 'score shirt', 'four']","[0.6507119536399841, 0.34928804636001587, 0.0]",introduc abraham lincoln four score seven beer ago shirt shirt perfect 4th juli celebr nation greatest presid human right advoc drink fresh beer also come sleeveless solid color 100 cotton heather grey 90 cotton 10 polyest heather 50 cotton 50 polyest machin wash cold like color dri low heat grab funni abe lincoln shirt gift patriot drink buddi 4th juli parti wear abraham drinkin juli fourth outfit bbq picnic firework parad independ memori day funni abe lincoln shirt perfect gift girlfriend boyfriend husband wife mom dad sister brother independ memori day wear patriot abraham lincoln four score shirt 4th juli parti lightweight classic fit doubleneedl sleev bottom hem complet 4th juli look summer suit,"['shirt shirt', 'abraham lincoln', 'presid human right', 'beer', 'color', 'abe lincoln', 'cotton', 'color', 'shirt gift', 'heat grab', 'score shirt', 'abraham lincoln', 'outfit bbq picnic firework', 'patriot', 'girlfriend boyfriend husband wife mom dad sister brother', 'summer suit', 'hem', 'gift', '50', 'four', '90', '4', '4', 'four', '50', '10', '100', '4', 'seven', '4']","[0.1825474053621292, 0.17343732714653015, 0.09936212748289108, 0.060594506561756134, 0.060594506561756134, 0.04911727458238602, 0.04529355838894844, 0.04191974550485611, 0.04191974550485611, 0.0369454026222229, 0.03631389141082764, 0.03430311381816864, 0.03396502509713173, 0.029230907559394836, 0.02573462203145027, 0.018101271241903305, 0.01766616478562355, 0.012953399680554867, 0.0, 0.0, 0.0, 0.0, 0.0, 0.0, 0.0, 0.0, 0.0, 0.0, 0.0, 0.0]"
49,dad bag belli fanni pack,"['dad bag', 'pack']","[0.6507119536399841, 0.34928804636001587]",wanna dad bod wanna get milf park wanna carri bier look fat perfect tool fanni pack incld 1 funni waist packssize3515cm materialpu canva leathergift 1x phone ring grip interest design print fake belli make bag funnythi sure bring laugh everyon face see thisfanni pack spacious compart decent zipper waist adjust comfortablemen beer belli waist pack bag love bag full person fresh uniqu hilari funni giftfunni spoof gift spoof tricki artifact suitabl gift spoof tricki excel funni gift silli offic parti even joke friend famili qualiti solid flimsi look realist even hair look real spaciousthi fanni pack practic useit interior space larg enough hold beer keychain cell phone mobil charger wallet comfort bring light weightyou attract eye crowd safe buy money back guarante tri best bring best use experi customersif unhappi purchasepleas contact team anytim want100 money back guarante safe buy,"['dad bod', 'milf park', 'tool', 'waist pack bag', 'zipper waist', 'belli', 'phone ring grip interest design print', 'gift', 'spoof gift spoof tricki artifact suitabl gift spoof', 'comfortablemen beer', 'bag funnythi', 'person', 'laugh', 'friend', 'flimsi', 'offic', 'money', 'face', 'mobil charger wallet comfort', 'beer keychain cell phone', 'tri', 'eye crowd', 'funni', 'weightyou', 'silli', 'purchasepleas contact team', 'experi', 'money', 'buy', 'space', 'spaciousthi', 'hair', '1', '1']","[0.1020231693983078, 0.1020231693983078, 0.1020231693983078, 0.05252258479595184, 0.04828764125704765, 0.045206621289253235, 0.03981028124690056, 0.03126058727502823, 0.03126058727502823, 0.03107924573123455, 0.028707284480333328, 0.027345851063728333, 0.0270155631005764, 0.025114908814430237, 0.025114908814430237, 0.025114908814430237, 0.023788826540112495, 0.023346401751041412, 0.02158031426370144, 0.02158031426370144, 0.020170507952570915, 0.018977046012878418, 0.016962066292762756, 0.016390632838010788, 0.014911730773746967, 0.013314356096088886, 0.013314356096088886, 0.013078923337161541, 0.011495268903672695, 0.00951162539422512, 0.00951162539422512, 0.008155536837875843, 0.0, 0.0]"
