,Title,Title_Entity,Title_Salience,Description,Description_Entity,Description_Salience
67,grow boyfriend full size,['size'],[1.0],sister friend singl forev life crisi friend boyfriend doesn't save day get boyfriend christma step start grow boyfriend full size add water grow 6time origin size 2inch approxim 12inch begin grow 2 hour reach full size 72 hour dri use it pretend grow perfect friend,"['sister friend', 'life', 'friend boyfriend', 'boyfriend', 'origin size', 'size', 'water', 'boyfriend christma step start', 'friend', 'dri', '72', '2', '12', '6', '2']","[0.26444387435913086, 0.21942761540412903, 0.1121140718460083, 0.07836982607841492, 0.07220415025949478, 0.061957184225320816, 0.0597827211022377, 0.05907938629388809, 0.038930200040340424, 0.03369096294045448, 0.0, 0.0, 0.0, 0.0, 0.0]"
68,grow girlfriend full size,['size'],[1.0],brother friend singl forev life crisi friend boyfriend doesn't save day get boyfriend christma step start grow boyfriend full size add water grow 6time origin size 2inch approxim 12inch begin grow 2 hour reach full size 72 hour dri use hem it pretend grow perfect friend,"['brother friend', 'life', 'friend boyfriend', 'boyfriend', 'origin size', 'size', 'water', 'boyfriend christma step start', 'dri use', 'friend', '2', '6', '2', '12', '72']","[0.2616414427757263, 0.21710222959518433, 0.11092594265937805, 0.07753930240869522, 0.07143896073102951, 0.06130059063434601, 0.05914917215704918, 0.05845329165458679, 0.043931443244218826, 0.03851763904094696, 0.0, 0.0, 0.0, 0.0, 0.0]"
69,thano glove sale – aveng marvel legend seri endgam power gauntlet articul electron fist,"['glove sale', 'marvel legend', 'power gauntlet articul electron fist']","[0.4766119718551636, 0.344807893037796, 0.1785801202058792]",tire parent sick teacher tire everybodi around like thano wipe everybodi snap finger aveng endgam premium roleplay item intric detail design electron articul power gauntlet inspir aveng endgam movi part marvel cinemat univers pulsat infin stone glow light effect electron fist appear teem tremend power activ power gauntlet 6 infin stone pulsat glow light aveng endgam movieinspir sound effect push infin stone center power gauntlet activ sound effect inspir aveng endgam movi fistlock display mode gauntlet high articul finger lock clench fist posit allow item display appropri power pose look marvel legend seri premium roleplay item fan marvel cinemat univers franchis look premium movieinspir marvel legend seri roleplay item sold separ subject avail,"['teacher tire', 'finger', 'endgam', 'tire parent', 'detail design electron articul power gauntlet', 'roleplay item', 'power', 'power gauntlet', 'effect', 'power gauntlet', 'cinemat univers franchis', 'sound effect', 'sound effect', 'electron fist', 'pulsat glow light', 'teem', 'appropri power', 'item display', 'look marvel legend', 'roleplay item', 'movieinspir marvel legend', 'subject avail', 'display mode gauntlet', 'finger lock clench fist', '6']","[0.1129208505153656, 0.1129208505153656, 0.1129208505153656, 0.10009196400642395, 0.05246113985776901, 0.05246113985776901, 0.03833526745438576, 0.036213673651218414, 0.03336826339364052, 0.033288683742284775, 0.032091472297906876, 0.031040459871292114, 0.031040459871292114, 0.030491255223751068, 0.027171503752470016, 0.026844840496778488, 0.026703599840402603, 0.021463928744196892, 0.021463928744196892, 0.01773051917552948, 0.015081675723195076, 0.013261351734399796, 0.011152376420795918, 0.009479951113462448, 0.0]"
70,dinosaur neon light display – neon bar lamp,"['dinosaur neon light display', 'neon bar lamp']","[0.5758325457572937, 0.4241674542427063]",dinosaur neon light display dinosaur neon light sort retro super fun bring joy happi shine pretti soft neon glow hous offic dorm room home bar nurseri look dorm room wall light look littl green guy dope look nurseri wall night light perfect soft glow sooth dinosaur total match nurseri decor neon bar lamp everyon want decor bar cool neon stuff actual look good dinosaur perfect look way better gross floresc beer sign make home bar fun cheer lite like plus super cheap look cheap bar decor look spec size approx 124″l x 74″h x 06″d，usb cabl length approx 92ft batteri usb charg oper use 3 aa batteriesnot includ usb adapt turn option way placedther hole behind lamp hang wall place tablecordless light fast easi instal also check similar product glow globe lamp ad ago power batteri usb choos,"['dinosaur neon light display dinosaur neon', 'fun', 'joy happi shine', 'neon glow hous offic dorm room home bar', 'dorm room wall light', 'usb', 'guy dope', 'neon', 'decor bar', 'look', 'decor neon bar lamp', 'home', 'floresc beer sign', 'match', 'stuff', 'bar decor look spec size', 'cheer lite', 'batteriesnot', 'lamp', 'wall place', 'batteri usb charg oper use', 'placedther hole', 'product glow globe lamp', 'easi', 'power batteri usb choos', '74', '06', '3', '92', '124']","[0.14281733334064484, 0.10929588973522186, 0.1031886488199234, 0.054013341665267944, 0.049216460436582565, 0.04102914035320282, 0.03966142237186432, 0.03945418819785118, 0.037268493324518204, 0.03475385904312134, 0.034337516874074936, 0.029180021956562996, 0.027955995872616768, 0.027619654312729836, 0.02728728950023651, 0.025683538988232613, 0.025683538988232613, 0.024178996682167053, 0.024178996682167053, 0.02208016999065876, 0.019423900172114372, 0.019423900172114372, 0.016993170604109764, 0.013639017008244991, 0.01163551677018404, 0.0, 0.0, 0.0, 0.0, 0.0]"
71,total useless inform – book fill stupid fact know,"['book', 'fact']","[0.5107659101486206, 0.489234060049057]",total useless inform pack stori weird unexpect plain bizarr learn strang scientif fact discov truth behind histor figur debunk popular urban legend thrill stori supernatur collect 150 entri expand knowledg broad rang topic includ histori human bodi anim cultur peopl sport crime place around world much vast array articl stori list question answer total useless trivia provid hour fascin read like also check useless book,"['bizarr', 'fact', 'truth', 'rang topic', 'figur', 'urban legend', 'human bodi anim', 'strang scientif', 'stori list question', 'stori supernatur', 'fascin', 'book', 'world', 'sport crime place', '150']","[0.18636032938957214, 0.11209841817617416, 0.11209841817617416, 0.07769177109003067, 0.07677165418863297, 0.07677165418863297, 0.07146826386451721, 0.06753376126289368, 0.0542420893907547, 0.04596315324306488, 0.03821313753724098, 0.0326370932161808, 0.024075130000710487, 0.024075130000710487, 0.0]"
72,chicken har – suitabl chicken duck goos,"['chicken har', 'suitabl chicken duck goos']","[0.6507119536399841, 0.34928804636001587]",easi adjust – ensur comfi fit chicken har truli adjust easi wear adjust size need make sure chicken 100 comfi matter feel uncomfort worri chicken get rid har walk chicken street enhanc chicken train fullest teach fowl walk leash find peac mind facilit train walk perform yesito har it easi tri see made last – ultra resili fabric boast durabl breathabl reinforc mesh fabric pet leash har set stand everyday wear tear seam come loos stitch fall apart we'v got cover give three color bow tie chicken har match color like walk chicken make person becom focus,"['easi', 'chicken har truli', 'chicken', 'chicken', 'size', 'har', 'cover', 'train walk', 'chicken street enhanc chicken train fullest', 'fowl walk leash', 'durabl', 'walk chicken', 'loos', 'color bow tie chicken har match color', 'person', 'focus', 'fabric pet leash har set', 'wear tear seam', '100', 'three']","[0.1863405555486679, 0.1863405555486679, 0.11661964654922485, 0.0814894586801529, 0.05996418371796608, 0.04829838499426842, 0.0419238917529583, 0.03855398669838905, 0.03629381209611893, 0.03609428182244301, 0.03376270458102226, 0.02784293331205845, 0.027493393048644066, 0.020433031022548676, 0.017972653731703758, 0.017972653731703758, 0.011301929131150246, 0.011301929131150246, 0.0, 0.0]"
73,real human bone sale,['human bone sale'],[1.0],look real human bone question ask buy real human bone whatev pleas 🙂 skull unlimit offer extens select real replica human skull skeleton real human skull skeleton obtain legal ethic sourcesyeah right howev specimen becom difficult find skull unlimit sure specimen need bag human bone consist various bone bone fragment bone minim clean purpos use train search rescu cadav dog sar pack bone pictur repres may includ bone may stain dri cut damag dog trainer troubl dog hit human bone even though may appear clean i'm serial killer don't ask question thank bye,"['human bone question', 'human bone whatev pleas', 'extens', 'skull', 'bag human bone', 'replica human skull skeleton', 'find skull', 'human bone', 'specimen', 'howev specimen', 'human skull skeleton', 'dog trainer troubl dog', 'ethic', 'bone bone fragment bone minim', 'train search', 'purpos', 'question', 'bone', 'serial killer', 'bye', 'cadav dog sar pack bone pictur repres']","[0.14547127485275269, 0.14136037230491638, 0.07664874941110611, 0.06798026710748672, 0.058281827718019485, 0.058071933686733246, 0.047000594437122345, 0.04070783779025078, 0.040074847638607025, 0.03959568217396736, 0.03959568217396736, 0.03616718947887421, 0.03487285599112511, 0.032435908913612366, 0.032435908913612366, 0.024549202993512154, 0.019614344462752342, 0.01807783544063568, 0.017249997705221176, 0.017249997705221176, 0.012557684443891048]"
74,blood pillow blood puddl pillow,['blood pillow blood puddl pillow'],[1.0],blood puddl pillow here great idea anyon look good lastminut fright blood puddl pillow thing scare crap roommat wake find lie pool red tomorrow morn blood puddl pillow look comfi shape like pool blood person prefer decor resembl blood bath could still put good use this'll perfect slip head shitti roommat pass drunk i'd love see look face wake think crack skull open bleed he jerk stumbl complet hammer leav front door open fall face first sofa begin snore mega loud make imposs get high peac i'm tri watch rerun frasier know nile quiet talker he got best joke ahhh man…,"['pool blood person', 'tri watch rerun frasier', 'blood puddl pillow', 'idea', 'use', 'look', 'lie pool', 'wake', 'blood puddl pillow thing', 'blood puddl pillow', 'wake', 'imposs', 'shape', 'blood bath', 'shitti roommat pass drunk', 'bleed', 'crack skull', 'peac', 'man', 'talker', 'door', 'joke', 'sofa']","[0.21805371344089508, 0.16611304879188538, 0.10271503031253815, 0.08344884216785431, 0.04753169044852257, 0.03733581677079201, 0.03713121637701988, 0.03713121637701988, 0.032711856067180634, 0.026976732537150383, 0.023477304726839066, 0.02276494912803173, 0.022219490259885788, 0.022219490259885788, 0.020659158006310463, 0.020659158006310463, 0.020659158006310463, 0.015617319382727146, 0.010961746796965599, 0.010961746796965599, 0.006883776281028986, 0.006883776281028986, 0.006883776281028986]"
75,uranium ore sale,['uranium ore sale'],[1.0],ore sampl natur occur radioact materi norm uranium ore sampl use check sourc test geiger countersno chemic spectral analysi perform radioact ore sampl sourc ore radioact determin may number radioact element uranium thorium potassium decay product radium radoncount per minut cpm activ rate list label activ level includ radiat type alpha beta gamma sinc alpha radiat main form radioact given ore sampl abl detect alpha radiat yield much lower count per minut cpm inexpens geiger counter detect alpha radiat check alpha sensit geiger counter import set geiger counter cpm mode locat hot spot ore sampl ore sampl check measur radioact use nrc certifi digit geiger counter pass ansistd n323a calibr use nist traceabl sourc independ govern licens lab conform nrc regul 10cfr34 10cfr35 make geiger counter suitabl regulatori inspect licens exempt radioact ore sampl size cpm activ vari ship label metal contain shown ship inform alway complianc section 13 part 40 nrc nuclear regulatori commiss rule regul postal servic regul specifi 49 cfr 173421 activ limit low level radioact materi item ship accord postal servic activ limit specifi public 52 radioact miner educ scientif use,"['radioact ore', 'geiger', 'uranium ore sampl use', 'ore sampl', 'analysi', 'check sourc test', 'element uranium thorium potassium decay product radium', 'alpha radiat', 'radioact', 'activ rate list label activ level', 'ore', 'geiger counter', 'geiger counter', 'count', 'radoncount', 'ore radioact determin', 'ore sampl ore sampl', 'alpha radiat check alpha', 'type alpha beta gamma sinc alpha', 'calibr use', 'measur radioact use', 'vari ship label metal', 'geiger counter import', 'mode', 'form', 'abl', 'geiger counter pass', 'ansistd', 'certifi digit', 'ship', 'regulatori', 'rule', 'complianc section', 'servic', 'activ', 'servic activ', 'scientif use', 'nist traceabl sourc', 'miner', 'materi item ship accord', 'geiger counter', 'activ', 'licens', 'radioact ore sampl size', 'licens lab', 'suitabl regulatori', 'nrc regul 10cfr34 10cfr35', '40', '13', '49', '10', '52', '173421', '10']","[0.08607615530490875, 0.07976316660642624, 0.0719943717122078, 0.0705043151974678, 0.05432850867509842, 0.05432850867509842, 0.035880718380212784, 0.02437640354037285, 0.02437640354037285, 0.023855509236454964, 0.022881513461470604, 0.021394530311226845, 0.021394530311226845, 0.021136190742254257, 0.02098984643816948, 0.02098984643816948, 0.020496699959039688, 0.02037752792239189, 0.0201313067227602, 0.017665108665823936, 0.017665108665823936, 0.014566179364919662, 0.014389513060450554, 0.014389513060450554, 0.014214970171451569, 0.014214970171451569, 0.013210907578468323, 0.013210907578468323, 0.013210907578468323, 0.012431454844772816, 0.012431454844772816, 0.00997257325798273, 0.00997257325798273, 0.00997257325798273, 0.009919490665197372, 0.009919490665197372, 0.009360264986753464, 0.007831178605556488, 0.006990519352257252, 0.006990519352257252, 0.006540299393236637, 0.006226516328752041, 0.004468717612326145, 0.004384871106594801, 0.004384871106594801, 0.003236408345401287, 0.002952087437734008, 0.0, 0.0, 0.0, 0.0, 0.0, 0.0, 0.0]"
76,dog wig – fashion blond wig dog,"['dog wig', 'fashion blond wig dog']","[0.6474345922470093, 0.35256537795066833]",dog alway want blond dog go tough time think present christma get dog wig dog complet chang shehe it like glass clart kent nobodi abl recogn dog wig could potenti useless product site don't care want dog chanc blond fun anybodi els might wonder would christma well could start take pictur dog wig start share onlin wig guarante dog famous around 10k follow social media don't know you'r mad want want wig bad rubi petshop sent goodi halloween you'r sit attitud earli morn missi “i wanna elsa” marg you'r gonna wonder woman sent stuff look sent hulk hog incred hulk sent you… ewok size small oh good right sent robin like batman robin cape sent cute caterpillar can't wait till it time put marg everybodi gonna elsa wanna differ look gorgeous wonder woman outfit you'r wear hair look like madonna look like christina aguleria “i don't care wanna elsuhh” noooo you'r gonna wonder woman nobodi wonder woman everybodi everi chi gonna elsa wanna differ wanna marg tiffani mwah thank rubi pet shop,"['dog wig dog', 'christma', 'dog', 'blond dog', 'clart kent', 'glass', 'dog wig', 'incred hulk', 'robin', 'elsa', 'pictur dog wig start share onlin wig guarante dog', 'dog chanc', 'anybodi els', 'product site', ""halloween you'r"", 'hulk hog', 'size', 'right', 'caterpillar', 'i wanna elsa', 'wonder woman outfit', ""marg you'r"", 'madonna', 'hair', 'woman', 'woman', 'woman', 'elsa', 'earli', 'rubi petshop', 'social media', 'stuff look', 'pet shop', 'christina aguleria', 'tiffani mwah', 'batman robin cape', '10k']","[0.2383904606103897, 0.08586771041154861, 0.08349182456731796, 0.08158717304468155, 0.052869174629449844, 0.052869174629449844, 0.028947556391358376, 0.02791248820722103, 0.02791248820722103, 0.026492608711123466, 0.025517167523503304, 0.02328759804368019, 0.02049620822072029, 0.02049620822072029, 0.017508715391159058, 0.012910563498735428, 0.012910563498735428, 0.012910563498735428, 0.012783896178007126, 0.010399672202765942, 0.00974910706281662, 0.009633205831050873, 0.009513591416180134, 0.009513591416180134, 0.0094930874183774, 0.009151097387075424, 0.009151097387075424, 0.008524051867425442, 0.00834255013614893, 0.007726789452135563, 0.007539844140410423, 0.007091923151165247, 0.006835978478193283, 0.0057765403762459755, 0.004046741873025894, 0.0023489755112677813, 0.0]"
77,expens basebal card – mickey mantl,"['card', 'mickey mantl']","[0.5758325457572937, 0.4241674542427063]",mickey mantl autograph set four enterprisesbg grade authent jsa certifi basebal slab autograph card bla bla bla look put card bike start make motorcycl sound tri order 3 set use bike use close pin clip front rear wheel make terrif clipclipclip sound ride street sound almost like motorcycl expens mickey mantl basebal card worth mone come free ship advic it buy least 3,"['mickey mantl autograph', 'slab autograph card', 'ship', 'look', 'bike use', 'mickey mantl basebal card', 'tri order', 'motorcycl', 'card bike start', 'wheel', 'bla bla bla', 'mone', 'terrif clipclipclip sound ride street sound', '3', '3', 'four']","[0.24159157276153564, 0.11197077482938766, 0.07712265849113464, 0.07252686470746994, 0.07128430157899857, 0.07084585726261139, 0.06288983672857285, 0.06214502081274986, 0.06214502081274986, 0.057852037250995636, 0.046229928731918335, 0.04390781745314598, 0.01948830671608448, 0.0, 0.0, 0.0]"
78,edibl anus chocol mold,['chocol mold'],[1.0],you'r realli naughti chocol lift lid box edibl anus box contain 6 anus shape chocol made solid milk chocol pleas warn adult novelti chocol suitabl children like know eat haha warn contain milk soya lecithin may also contain trace nut food item nonreturn affect statutori right edibl anus first saw light day 2006 london artist magnus irvin made rang multicolour chocol present exhibit ensu show met form partnership mr ritzema tall man dutch desent sinc two work togeth make rang product avail today initi mr irvin tri cast anus messi disastr result whilst explain failur chanc acquaint bus stop gratifi find fellow bus passeng will allow cast anus job done half hour later afternoon subsequ anus base cast matter interest person kind donat servic idea anus gone global chocol glass metal anus sinc appear exhibit unusu high street retail whilst chocol anus bought decern custom world ring succul chocol love cast craft delect posterior stun butt model luxuri chocol uniqu manufactur entir uk watch grandma face light unwrap home select chocol crack perfect gift famili bustin taboo sinc 2002 believ edibl anus help break cultur boundari race class gender sexual orient amus easili digest way preserv sell fresh chocol,"['lift lid box edibl anus box', 'anus shape', 'milk chocol pleas', 'magnus irvin', 'anus', 'children', 'bus passeng', 'anus', 'trace nut food item', 'milk soya lecithin', 'chocol', 'irvin', 'mr', 'partnership mr', 'exhibit', 'tri', 'work togeth', 'disastr result', 'bus stop', 'show', 'desent', 'anus', 'anus base', 'interest person', 'gratifi', 'anus job', 'chocol', 'rang product avail', 'unwrap', 'love cast craft delect posterior stun butt model', 'gift famili', 'grandma', 'london', 'chocol anus', 'anus', 'easili', 'cultur boundari race class gender', 'orient', 'luxuri chocol uniqu manufactur entir uk', 'exhibit', 'street', 'retail', 'world ring', '2006', '2002', '2002', 'two', '6', '2006']","[0.11728054285049438, 0.0720752403140068, 0.0720752403140068, 0.047644682228565216, 0.04624573513865471, 0.04058515280485153, 0.03427153453230858, 0.031810957938432693, 0.027890831232070923, 0.027890831232070923, 0.022096486762166023, 0.021748580038547516, 0.021748580038547516, 0.021485313773155212, 0.021485313773155212, 0.019126512110233307, 0.019126512110233307, 0.019126512110233307, 0.019126512110233307, 0.01889466866850853, 0.01889466866850853, 0.01796087436378002, 0.01756090484559536, 0.01756090484559536, 0.016521012410521507, 0.01612235978245735, 0.015512862242758274, 0.01516697183251381, 0.013258333317935467, 0.013258333317935467, 0.013258333317935467, 0.012625103816390038, 0.011206506751477718, 0.009743670001626015, 0.009743670001626015, 0.009295083582401276, 0.009295083582401276, 0.009295083582401276, 0.007854063995182514, 0.0066369459964334965, 0.005831160582602024, 0.005831160582602024, 0.005831160582602024, 0.0, 0.0, 0.0, 0.0, 0.0, 0.0]"
79,bubblegum stuff cat selfi,['bubblegum stuff cat'],[1.0],take purrfect catselfi made easi kitti companion pur n pose one sight hang bell – rest instagram histori ring bell revers compat smartphon,"['catselfi', 'sight hang bell', 'companion pur n', 'histori ring bell revers', 'smartphon', 'instagram', 'one']","[0.47899603843688965, 0.15588732063770294, 0.14802227914333344, 0.10587316751480103, 0.0827229917049408, 0.0284982081502676, 0.0]"
80,booz ball – booz fill ornament,"['ball', 'ornament']","[0.5906979441642761, 0.4093020260334015]",merri bright holiday season booz fill ornament hang tree put mini tree mini bar fill favorit whiski wine vodka gin sure hit imagin holiday offic parti friend christma famili gettogeth ornament peopl laugh grab ball drink merri basic fcking willi wonka christma alcohol know realli hang year round amaz booz fill ornament come pack 6 you'r gonna need least three realli get parti start children hang high tree like check christma ornament decor,"['fill ornament', 'tree', 'holiday season', 'tree', 'bar', 'realli', 'realli', 'ball drink', 'gettogeth ornament peopl', 'holiday offic', 'vodka gin', 'friend', 'tree', 'booz fill ornament', 'alcohol', 'check christma ornament decor', 'children', 'round', ""you'r"", 'three', '6']","[0.1802741140127182, 0.1691734790802002, 0.13844993710517883, 0.06849993765354156, 0.05534131079912186, 0.03986138105392456, 0.03891527280211449, 0.03820076212286949, 0.03820076212286949, 0.037744276225566864, 0.037744276225566864, 0.037744276225566864, 0.023283062502741814, 0.020570266991853714, 0.01916363649070263, 0.018702814355492592, 0.018702814355492592, 0.011763808317482471, 0.007663812022656202, 0.0, 0.0]"
81,essenti oil diffus – dumpl diffus smoko,['oil diffus'],[1.0],introduc essenti oil diffus shape cute smile dumpl product made smoko offer 7 differ mood light provid therapeut support help revit reliev stress find natur balanc diffus use pure essenti oil creat restor aroma condit air spread fragranc cute function design dumpl diffus make fantast gift friend famili choos 7 differ color bright dim mode match style decor auto cycl color make great accessori home offic bedroom babi room etc smart timer auto shutoff – easili swap 1 3 6hour continu mode creat even essenti oil distribut like diffus boast 300ml water capac waterless autooff function safer function trust qualiti guarante – ultim provid 100 satisfact dumpl diffus back 1 year manufactur warranti contact us issu order respons solut,"['dumpl diffus', 'essenti oil', 'offer', 'smile dumpl product', 'revit reliev stress find natur', 'therapeut support help', 'color', 'oil creat', 'mode match style decor auto cycl color', 'fantast gift friend famili', 'air spread', 'aroma', 'home offic bedroom babi room', 'timer auto shutoff', 'autooff function', 'water', 'manufactur warranti', 'qualiti guarante', 'function trust', 'accessori', 'order respons solut', 'diffus', 'mode creat', 'oil distribut', '6', '300', '7', '1', '3', '100', '1', '7']","[0.20273886620998383, 0.12578411400318146, 0.1022988110780716, 0.1022988110780716, 0.040212880820035934, 0.040212880820035934, 0.03142615035176277, 0.031048670411109924, 0.028875451534986496, 0.02766336500644684, 0.027330316603183746, 0.027330316603183746, 0.025413265451788902, 0.025413265451788902, 0.023923667147755623, 0.021845869719982147, 0.019690094515681267, 0.019216524437069893, 0.019216524437069893, 0.015107222832739353, 0.013491474092006683, 0.011344635859131813, 0.009642526507377625, 0.008474300615489483, 0.0, 0.0, 0.0, 0.0, 0.0, 0.0, 0.0, 0.0]"
82,boob christma tree ornament,['boob christma tree ornament'],[1.0],beauti boob christma tree ornament time holiday season need someth sexi feminin tree ornament perfect everyon love boob tree definit order one forum novelti ornament measur 6 x 6 x 6 inch pretti big plan rrate tree check ornament blog post boob christma tree ornament go perfect alcohol booz ball,"['boob christma tree', 'novelti ornament', 'someth sexi feminin tree ornament', 'forum', 'boob tree definit order', 'everyon', 'plan rrate tree check ornament blog post boob christma tree ornament', 'ball', 'alcohol', 'one', '6', '6', '6']","[0.37632355093955994, 0.11681467294692993, 0.11548451334238052, 0.08392541110515594, 0.08392541110515594, 0.08294953405857086, 0.05723978206515312, 0.04166856408119202, 0.04166856408119202, 0.0, 0.0, 0.0, 0.0]"
83,mini close terrarium keychain,['terrarium keychain'],[1.0],check ador mini close terrarium keychain keychain contain coral cactus close insid littl clear dome live breath cactus put keychain care littl suckl grow replant mini close terrarium live capsul 3 month littl depend fast grow easi water tini hole bottom locat root keychain includ care card caricatur care magnet also includ 2week plant health warranti make excel christma gift addon holiday gift stock stuffer great hipster,"['terrarium keychain keychain', 'coral cactus', 'insid', 'dome', 'water tini', 'breath cactus', 'terrarium', 'keychain care littl', '2week plant health warranti', 'hipster', 'christma gift addon holiday gift stock stuffer', 'root keychain', 'care card caricatur care magnet', '3', '2']","[0.3451194763183594, 0.09010941535234451, 0.07965850830078125, 0.07965850830078125, 0.07965850830078125, 0.07211680710315704, 0.06257792562246323, 0.0582750029861927, 0.038545094430446625, 0.027154723182320595, 0.027154723182320595, 0.02286321297287941, 0.01710808277130127, 0.0, 0.0]"
